{
    "$schema": "http://json-schema.org/draft-07/schema#",
    "title": "Confirmation of Enrolment",
    "type": "object",
    "properties": {
        "credentialTitle":{
            "title": "Credential title",
            "description": "",
            "type": "object",
            "x-format": "languageMap",
            "patternProperties": {
                "^[a-z]{2}$": {
                "type": "string",
                "description": "A string value for a specific language code."
                }
            },
            "additionalProperties": false
        },"fullName":{
            "title": "Full name",
            "description": "",
            "type": "object",
            "x-format": "languageMap",
            "patternProperties": {
                "^[a-z]{2}$": {
                "type": "string",
                "description": "A string value for a specific language code."
                }
            },
            "additionalProperties": false
        },"dateOfBirth":{
            "title":  "Date of birth",
            "description": "",
            "type": "string",
            "format": "date-time"

        },"placeOfBirth":{
            "title": "Country of birth",
            "description": "",
            "x-format": "languageMap",
            "patternProperties": {
                "^[a-z]{2}$": {
                "type": "string",
                "description": "A string value for a specific language code."
                }
            },
            "additionalProperties": false
        },"fullAddress":{
            "title": "City of birth",
            "description": "",
            "type": "object",
            "x-format": "languageMap",
            "patternProperties": {
                "^[a-z]{2}$": {
                "type": "string",
                "description": "A string value for a specific language code."
                }
            },
            "additionalProperties": false
        },"studentNumber":{
            "title": "Student number",
            "description": "",
            "type": "string"
        },"academicYear":{
            "title":  "Academic Year",
            "description": "",
            "type": "string"
        }, "programmeTitle":{
            "title": "Programme Title",
            "description": "",
            "type": "object",
            "x-format": "languageMap",
            "patternProperties": {
                "^[a-z]{2}$": {
                "type": "string",
                "description": "A string value for a specific language code."
                }
            },
            "additionalProperties": false
        }, "validUntil":{
            "title": "Valid until",
            "description": "Date the certificate becomes expired.",
            "type": "string",
            "format": "date-time"
        }   
    }, "required": [
        "credentialTitle",
        "programmeTitle",
        "placeOfBirth",
        "fullAddress"
    ]
}